{
  "$schema": "https://condenser-team.github.io/condenser-registry/schema/plugins/versions",
  "@context": "https://schema.org/",
  "@type": "SoftwareApplication",
  "@id": "https://condenser-team.github.io/condenser-registry/plugins/condenser-plugin/versions/0.4.0",
  "name": "Condenser Plugin 0.4.0",
  "version": "0.4.0",
  "datePublished": "2026-05-29",
  "releaseNotes": "Testing plugin",
  "isPartOf": {
    "@id": "https://condenser-team.github.io/condenser-registry/plugins/condenser-plugin",
    "@type": "SoftwareApplication",
    "name": "Condenser Plugin"
  },
  "associatedMedia": [
    {
      "@type": "MediaObject",
      "name": "condenser-plugin 0.4.0",
      "contentUrl": "https://github.com/condenser-team/condenser-plugin/releases/download/v0.4.0/condenser-plugin-0.4.0.zip",
      "encodingFormat": "application/zip",
      "license": "https://spdx.org/licenses/MIT.html",
      "sha256": "dfd2f0f885f30278b6ef1114a2ceb80f78cd6b8fa1112e7cccbee2e690f0d670",
      "operatingSystem": [
        "linux",
        "macos",
        "windows"
      ],
      "processorRequirements": [
        "x86_64",
        "arm64"
      ]
    }
  ]
}